{
  "config": {
    "duration_s": 8.0,
    "failure_max_m": 0.5,
    "failure_p95_m": 0.25,
    "observation_period_s": 0.1,
    "seed": 17,
    "target_acceleration_mps2": 0.0,
    "target_speed_mps": 0.7,
    "truth_dt_s": 0.02
  },
  "criterion_note": "The failure label is a scenario-specific research criterion, not a safety threshold. Each failure row's criterion text says whether it still fails with zero loss and zero noise. Peak target speed in this grid is 1.9 m/s against the 2 m/s reference vehicle limit. The tracker is told the true noise (oracle tuning), a known limit that flatters it. One seed per cell: no intervals are reported, so small differences are not evidence.",
  "independent_check": "The estimator arm is a receive-time (naive) tracker: it applies each measurement at arrival, stamped with its arrival time, so its error grows like speed x delay by construction: v x delay = 0.7 m/s x 0.2 s = 0.14 m at the largest delay (plus up to one display step). Separately, the held-last observation-period lag is speed x observation period = 0.7 m/s x 0.1 s = 0.07 m before noise or dropout. No recovery arm exists yet, so this sweep does not show what recovers a tracker. Packets use SimulatedLink and measurements use SensorModel, one shared seed for every cell.",
  "rows": [
    {
      "criterion": "p95>0.25 m OR max>0.5 m",
      "delay_s": 0.0,
      "held_last_max_error_m": 0.056000000000000494,
      "held_last_p95_error_m": 0.05600000000000005,
      "label": "within-scenario-envelope",
      "loss_probability": 0.0,
      "max_error_m": 0.055999999999999994,
      "mean_age_s": 0.0,
      "noise_std_m": 0.0,
      "p95_error_m": 2.080321211406222e-07,
      "sample_count": 401,
      "target_acceleration_mps2": 0.0
    },
    {
      "criterion": "p95>0.25 m OR max>0.5 m",
      "delay_s": 0.0,
      "held_last_max_error_m": 0.15127999999999986,
      "held_last_p95_error_m": 0.12727999999999984,
      "label": "within-scenario-envelope",
      "loss_probability": 0.0,
      "max_error_m": 0.056479999999999995,
      "mean_age_s": 0.0,
      "noise_std_m": 0.0,
      "p95_error_m": 0.0008264103049695493,
      "sample_count": 401,
      "target_acceleration_mps2": 0.15
    },
    {
      "criterion": "p95>0.25 m OR max>0.5 m",
      "delay_s": 0.0,
      "held_last_max_error_m": 0.1311204696002892,
      "held_last_p95_error_m": 0.08278387193276104,
      "label": "within-scenario-envelope",
      "loss_probability": 0.0,
      "max_error_m": 0.07697528767749251,
      "mean_age_s": 0.0,
      "noise_std_m": 0.02,
      "p95_error_m": 0.046149088414497164,
      "sample_count": 401,
      "target_acceleration_mps2": 0.0
    },
    {
      "criterion": "p95>0.25 m OR max>0.5 m",
      "delay_s": 0.0,
      "held_last_max_error_m": 0.18206279514167015,
      "held_last_p95_error_m": 0.14590807463452699,
      "label": "within-scenario-envelope",
      "loss_probability": 0.0,
      "max_error_m": 0.07743272735942294,
      "mean_age_s": 0.0,
      "noise_std_m": 0.02,
      "p95_error_m": 0.04937008390323741,
      "sample_count": 401,
      "target_acceleration_mps2": 0.15
    },
    {
      "criterion": "p95>0.25 m OR max>0.5 m",
      "delay_s": 0.0,
      "held_last_max_error_m": 0.24776725434695734,
      "held_last_p95_error_m": 0.15753979449101838,
      "label": "within-scenario-envelope",
      "loss_probability": 0.0,
      "max_error_m": 0.13401883847118948,
      "mean_age_s": 0.0,
      "noise_std_m": 0.05,
      "p95_error_m": 0.09490413244948993,
      "sample_count": 401,
      "target_acceleration_mps2": 0.0
    },
    {
      "criterion": "p95>0.25 m OR max>0.5 m",
      "delay_s": 0.0,
      "held_last_max_error_m": 0.29483512392857386,
      "held_last_p95_error_m": 0.196261596074086,
      "label": "within-scenario-envelope",
      "loss_probability": 0.0,
      "max_error_m": 0.14200495557076634,
      "mean_age_s": 0.0,
      "noise_std_m": 0.05,
      "p95_error_m": 0.0990757799510636,
      "sample_count": 401,
      "target_acceleration_mps2": 0.15
    },
    {
      "criterion": "p95>0.25 m OR max>0.5 m",
      "delay_s": 0.0,
      "held_last_max_error_m": 0.1260000000000001,
      "held_last_p95_error_m": 0.09800000000000009,
      "label": "within-scenario-envelope",
      "loss_probability": 0.1,
      "max_error_m": 0.055999999999999994,
      "mean_age_s": 0.0,
      "noise_std_m": 0.0,
      "p95_error_m": 4.1606436707031236e-07,
      "sample_count": 401,
      "target_acceleration_mps2": 0.0
    },
    {
      "criterion": "p95>0.25 m OR max>0.5 m",
      "delay_s": 0.0,
      "held_last_max_error_m": 0.3066299999999984,
      "held_last_p95_error_m": 0.19487999999999772,
      "label": "within-scenario-envelope",
      "loss_probability": 0.1,
      "max_error_m": 0.056479999999999995,
      "mean_age_s": 0.0,
      "noise_std_m": 0.0,
      "p95_error_m": 0.0026257594237373283,
      "sample_count": 401,
      "target_acceleration_mps2": 0.15
    },
    {
      "criterion": "p95>0.25 m OR max>0.5 m",
      "delay_s": 0.0,
      "held_last_max_error_m": 0.1449854229005,
      "held_last_p95_error_m": 0.11141267453939674,
      "label": "within-scenario-envelope",
      "loss_probability": 0.1,
      "max_error_m": 0.07697528767749251,
      "mean_age_s": 0.0,
      "noise_std_m": 0.02,
      "p95_error_m": 0.05220001436732837,
      "sample_count": 401,
      "target_acceleration_mps2": 0.0
    },
    {
      "criterion": "p95>0.25 m OR max>0.5 m",
      "delay_s": 0.0,
      "held_last_max_error_m": 0.31586152957214914,
      "held_last_p95_error_m": 0.20352447009209754,
      "label": "within-scenario-envelope",
      "loss_probability": 0.1,
      "max_error_m": 0.07743272735942294,
      "mean_age_s": 0.0,
      "noise_std_m": 0.02,
      "p95_error_m": 0.05234637214382799,
      "sample_count": 401,
      "target_acceleration_mps2": 0.15
    },
    {
      "criterion": "p95>0.25 m OR max>0.5 m",
      "delay_s": 0.0,
      "held_last_max_error_m": 0.24776725434695734,
      "held_last_p95_error_m": 0.161967063183224,
      "label": "within-scenario-envelope",
      "loss_probability": 0.1,
      "max_error_m": 0.15731947656667702,
      "mean_age_s": 0.0,
      "noise_std_m": 0.05,
      "p95_error_m": 0.1077784256521708,
      "sample_count": 401,
      "target_acceleration_mps2": 0.0
    },
    {
      "criterion": "p95>0.25 m OR max>0.5 m",
      "delay_s": 0.0,
      "held_last_max_error_m": 0.33513088851197,
      "held_last_p95_error_m": 0.23295527906421137,
      "label": "within-scenario-envelope",
      "loss_probability": 0.1,
      "max_error_m": 0.14826831234753,
      "mean_age_s": 0.0,
      "noise_std_m": 0.05,
      "p95_error_m": 0.11023261957240602,
      "sample_count": 401,
      "target_acceleration_mps2": 0.15
    },
    {
      "criterion": "p95>0.25 m OR max>0.5 m",
      "delay_s": 0.0,
      "held_last_max_error_m": 0.26599999999999957,
      "held_last_p95_error_m": 0.168,
      "label": "within-scenario-envelope",
      "loss_probability": 0.3,
      "max_error_m": 0.055999999999999994,
      "mean_age_s": 0.0,
      "noise_std_m": 0.0,
      "p95_error_m": 9.019150989997282e-06,
      "sample_count": 401,
      "target_acceleration_mps2": 0.0
    },
    {
      "criterion": "p95>0.25 m OR max>0.5 m",
      "delay_s": 0.0,
      "held_last_max_error_m": 0.5447299999999995,
      "held_last_p95_error_m": 0.30112000000000094,
      "label": "within-scenario-envelope",
      "loss_probability": 0.3,
      "max_error_m": 0.056479999999999995,
      "mean_age_s": 0.0,
      "noise_std_m": 0.0,
      "p95_error_m": 0.006301302015617516,
      "sample_count": 401,
      "target_acceleration_mps2": 0.15
    },
    {
      "criterion": "p95>0.25 m OR max>0.5 m",
      "delay_s": 0.0,
      "held_last_max_error_m": 0.27561719909734916,
      "held_last_p95_error_m": 0.16530215620121344,
      "label": "within-scenario-envelope",
      "loss_probability": 0.3,
      "max_error_m": 0.07697528767749251,
      "mean_age_s": 0.0,
      "noise_std_m": 0.02,
      "p95_error_m": 0.057022096101366423,
      "sample_count": 401,
      "target_acceleration_mps2": 0.0
    },
    {
      "criterion": "p95>0.25 m OR max>0.5 m",
      "delay_s": 0.0,
      "held_last_max_error_m": 0.553101766439582,
      "held_last_p95_error_m": 0.3091043911338345,
      "label": "within-scenario-envelope",
      "loss_probability": 0.3,
      "max_error_m": 0.07743272735942294,
      "mean_age_s": 0.0,
      "noise_std_m": 0.02,
      "p95_error_m": 0.057594740009975984,
      "sample_count": 401,
      "target_acceleration_mps2": 0.15
    },
    {
      "criterion": "p95>0.25 m OR max>0.5 m",
      "delay_s": 0.0,
      "held_last_max_error_m": 0.2984307590079929,
      "held_last_p95_error_m": 0.20028673719882492,
      "label": "within-scenario-envelope",
      "loss_probability": 0.3,
      "max_error_m": 0.13713045676528848,
      "mean_age_s": 0.0,
      "noise_std_m": 0.05,
      "p95_error_m": 0.111300141456449,
      "sample_count": 401,
      "target_acceleration_mps2": 0.0
    },
    {
      "criterion": "p95>0.25 m OR max>0.5 m",
      "delay_s": 0.0,
      "held_last_max_error_m": 0.570079439703697,
      "held_last_p95_error_m": 0.34318207792155264,
      "label": "within-scenario-envelope",
      "loss_probability": 0.3,
      "max_error_m": 0.14534312158149862,
      "mean_age_s": 0.0,
      "noise_std_m": 0.05,
      "p95_error_m": 0.11309572350344105,
      "sample_count": 401,
      "target_acceleration_mps2": 0.15
    },
    {
      "criterion": "p95>0.25 m OR max>0.5 m",
      "delay_s": 0.05,
      "held_last_max_error_m": 0.09800000000000075,
      "held_last_p95_error_m": 0.09799999999999998,
      "label": "within-scenario-envelope",
      "loss_probability": 0.0,
      "max_error_m": 0.098,
      "mean_age_s": 0.059999999999999866,
      "noise_std_m": 0.0,
      "p95_error_m": 0.042000000308141106,
      "sample_count": 401,